image,caption_number,caption,id
7600282242.jpg,4,Một cầu thủ bóng chày đang vung chiếc gậy về phía quả bóng chày,30446
761000714.jpg,0,Một nhóm trẻ em trong trang phục xanh và đỏ đang chơi bóng đá,30461
761000714.jpg,1,Những đứa trẻ trẻ đang chơi bóng đá trên sân cỏ,30461
761000714.jpg,2,Năm đứa trẻ đang đuổi theo một quả bóng đá,30461
761000714.jpg,3,Năm đứa trẻ đang chơi bóng đá,30461
761000714.jpg,4,Những đứa trẻ đang chơi bóng đá cùng nhau trên một sân cỏ,30461
7652712058.jpg,0,Một trận bóng đá với đội áo sọc xanh đang cố gắng ghi bàn thắng trong khi đó đội bóng với trang phục màu đỏ đang bảo vệ khung thành,30520
7652712058.jpg,1,Một trận đấu bóng đá đang được diễn ra giữa đội màu đỏ và đội màu xanh,30520
7652712058.jpg,2,Một trận bóng đá chuyên nghiệp đang diễn ra trên sân vận động,30520
7652712058.jpg,3,Một cầu thủ trong trang phục xanh đang cố gắng rê bóng trước sự phòng vệ của các cầu thủ đội đỏ,30520
7652712058.jpg,4,Các cầu thủ đang thi đấu trên sân vận động trong một trận đấu bóng đá với rất đông khán giả đến xem,30520
7677915788.jpg,0,Một bàn thắng vừa được ghi trong một trận bóng đá giữa hai đội một đội mặc trang phục màu đỏ và đội kia mặc trang phục màu vàng,30567
7677915788.jpg,1,Một cầu thủ thuộc đội bóng màu đỏ vừa ghi bàn trong khi đội đối thủ đang nhìn quả bóng đi vào,30567
7677915788.jpg,2,Một vài cầu thủ bóng đá đang chăm chú theo dõi bóng và người thủ môn,30567
7677915788.jpg,3,Một số cầu thủ bóng đá đang quan sát một thủ môn cố gắng bảo vệ khung thành khỏi cú sút,30567
7677915788.jpg,4,Những người đàn ông đang chơi bóng đá trên một sân cỏ ngoài trời,30567
7700078440.jpg,0,Một thành viên của một đội bóng chuyền vừa đánh bóng qua lưới trong khi đội khác đang cố gắng chặn nó,30592
7700078440.jpg,1,Hai đội bóng chuyền đang thi đấu với nhau đội bóng có trang phục màu xanh đỏ đang cố gắng chặn cú đánh từ đội màu trắng,30592
7700078440.jpg,2,Hai đội bóng chuyền nữ đang cạnh tranh trong một trận đấu bóng chuyền với một số khán giả đến xem,30592
7700078440.jpg,3,Hai đội bóng chuyền nữ đều mặc đồng phục cạnh tranh với nhau trong một trận đấu bóng chuyền,30592
7700078440.jpg,4,Một trận đấu bóng chuyền nữ đang diễn ra trong nhà,30592
7700080224.jpg,0,Hai đội bóng chuyền nữ đang cạnh tranh với nhau trên sân trong khi trọng tài trong trang phục đen đang quan sát trận đấu,30594
7700080224.jpg,1,Những người phụ nữ đang thi đấu trong một trận đấu bóng chuyền,30594
7700080224.jpg,2,Những người phụ nữ đang chơi bóng chuyền trên sân vận động trong nhà,30594
7700080224.jpg,3,Trong một trận đấu bóng chuyền một cầu thủ trang phục màu trắng đang nhảy lên để đỡ bóng,30594
7700080224.jpg,4,Một số người phụ nữ đang chơi bóng chuyền,30594
7754646766.jpg,0,Một người phụ nữ mặc đồng phục bóng rổ màu trắng và đỏ chuẩn bị ném phạt trong trận đấu bóng rổ,30691
7754646766.jpg,1,Một nữ cầu thủ bóng rổ đang chuẩn bị ném bóng trong khi những người chơi khác đang quan sát cô ấy,30691
7754646766.jpg,2,Một người phụ nữ mặc đồng phục bóng rổ màu đỏ và trắng chuẩn bị ném một cú ném phạt,30691
7754646766.jpg,3,Những cầu thủ bóng rổ đứng ở hai bên trong khi cô gái trong trang phục trắng chuẩn bị ném bóng,30691
7754646766.jpg,4,Một nữ cầu thủ bóng rổ đang ném một cú ném trong trận đấu,30691
7754828606.jpg,0,Một cầu thủ bóng chuyền trong trang phục màu đỏ cố gắng đánh một quả bóng trong khi hai cầu thủ mặc áo màu đang chặn bóng qua lưới trong một trận đấu bóng chuyền,30693
7754828606.jpg,1,Một người đàn ông đang nhảy lên đánh một quả bóng chuyền,30693
7754828606.jpg,2,Một người đàn ông đang đánh một quả bóng chuyền qua lưới,30693
7754828606.jpg,3,Người đàn ông nhảy lên để đánh quả bóng về phía đối thủ,30693
7754828606.jpg,4,Đàn ông đang chơi bóng chuyền trên sân,30693
7757250094.jpg,0,Người đánh bóng vừa đánh một quả bóng trong khi trọng tài và người bắt nhìn theo đường bóng bay,30701
7757250094.jpg,1,Một cầu thủ bóng chày nhìn theo quả bóng đang bay khi vừa mới vung gậy đánh nó,30701
7757250094.jpg,2,Một số người đứng bên ngoài hàng rào xem một cậu bé đánh bóng,30701
7757250094.jpg,3,Một cầu thủ bóng chày vung gậy của mình để đánh một quả bóng chày,30701
7757250094.jpg,4,Người chơi bóng chày đang chơi bóng chày tại công viên,30701
7764482932.jpg,0,Một cầu thủ bóng chuyền tóc vàng trong một chiếc áo xám và mang kính râm đánh một quả bóng chuyền trong khi đứng trên cát,30714
7764482932.jpg,1,Một chiếc kính râm của cầu thủ bóng chuyền cho thấy sự phản chiếu của bóng chuyền ở phía trước mặt cô ấy,30714
7764482932.jpg,2,Một người phụ nữ đang đỡ một quả bóng chuyền trên bãi biển,30714
7764482932.jpg,3,Một người phụ nữ tóc vàng chơi bóng chuyền vào một ngày nắng ở bãi biển,30714
7764482932.jpg,4,Một cô gái đang chơi bóng chuyền trên bãi biển,30714
7812612114.jpg,0,Một cầu thủ bóng đá trong một chiếc áo trắng đang ngã xuống đất trong khi người chơi mặc áo xanh giành lấy quyền kiểm soát bóng,30793
7812612114.jpg,1,Hai cầu thủ bóng đá trong trang phục màu xanh lá cây cố gắng cướp lấy bóng từ một cầu thủ mặc đồ trắng,30793
7812612114.jpg,2,Hai đội bóng đá đang cạnh tranh ở một sân vận động với đầy người xem,30793
7812612114.jpg,3,Một trò chơi bóng đá đang diễn ra trong khi hai đội đang tranh giành quả bóng,30793
7812612114.jpg,4,Những người đàn ông đang tham gia một trận đấu bóng đá,30793
7863346994.jpg,0,Trên sân bóng rổ ngoài trời một người đàn ông nhảy về phía rổ với quả bóng trong khi một số người chơi khác nhìn vào,30843
7863346994.jpg,1,Năm người đàn ông nhìn vào một người đàn ông khác đang nhảy lên trong khi cố gắng ném một quả bóng rổ,30843
7863346994.jpg,2,Một người đàn ông đang nhảy với quả bóng trong tay trong một trận bóng rổ,30843
7863346994.jpg,3,Những người đàn ông chơi bóng rổ và anh chàng áo xanh đang cố gắng ghi bàn,30843
7863346994.jpg,4,Một nhóm đàn ông đang chơi bóng rổ trên sân ngoài trời,30843
7920471750.jpg,0,Một cầu thủ bóng chày đang trượt vào gôn nhà trong khi người bắt cố gắng gắn thẻ anh ta và trọng tài đang đứng bên cạnh quan sát,30887
7920471750.jpg,1,Một người chạy đang trượt vào gôn nhà cố gắng tránh né người bắt bóng trong một trận bóng chày,30887
7920471750.jpg,2,Một người chơi trượt về nhà trong khi những người bắt bóng cố gắng ngăn cản anh ta,30887
7920471750.jpg,3,Một trọng tài đã sẵn sàng để thực hiện một dấu hiệu trong một trò chơi bóng chày,30887
7920471750.jpg,4,Một trong tài đang quan sát một cầu thủ bóng chày trượt về nhà,30887
7958174552.jpg,0,Hai người đàn ông mặc đồng phục và ngồi xe lăn đang tiếp cận một quả bóng trắng trên sân bóng rổ,30920
7958174552.jpg,1,Hai đội đang cạnh tranh quả bóng rổ trong không trung,30920
7958174552.jpg,2,Trận đấu bóng chuyền dành cho người khuyết tật diễn ra với hai đội màu vàng và đội màu đỏ trong khi hai đội bóng rổ đnag tranh giành nhau quả bóng,30920
7958174552.jpg,3,Những người đàn ông thách thức về thể chất trong xe lăn tham gia vào một trò chơi thể thao,30920
7958174552.jpg,4,Hai thành viên của một đội bóng rổ với xe lăn cạnh tranh lẫn nhau,30920
8040947572.jpg,0,Một cầu thủ bóng bầu dục trong bộ đồng phục màu đỏ và đen và một chiếc mũ bảo hiểm màu đen đang giữ bóng và bị bao quanh bởi những người chơi đối thú mặc đồng phục màu trắng và tím,31025
8040947572.jpg,1,Một cầu thủ bóng bầu dục trong một chiếc áo đỏ và đen đang cố gắng vượt khỏi sự truy đuổi của các thành viên đội màu trắng tím,31025
8040947572.jpg,2,Một đội bóng bầu dục mặc áo màu tím và trắng cố gắng ngăn chặn cầu thủ với quả bóng trên tay,31025
8040947572.jpg,3,Một nhóm các cầu thủ bóng bầu dục cố gắng ngăn chặn một người chơi khác,31025
8040947572.jpg,4,Các cầu thủ đang tham gia thi đấu một trận đấu bóng bầu dục,31025
8052575239.jpg,0,Hàng trăm khán giả đang xem một trận bóng đá giữa một đội mặc áo xanh lá và một đội mặc áo đen,31046
8052575239.jpg,1,Một quả bóng đá vừa được đá bởi một đội mặc đồng phục màu đen,31046
8052575239.jpg,2,Một đám đông xem hai đội tham gia một trận đấu bóng đá trên sân,31046
8052575239.jpg,3,Những người đàn ông đang chơi trên sân bóng đá,31046
8052575239.jpg,4,Một trận đấu bóng đá diễn ra khi đội đen vừa phát quả bóng,31046
8112722587.jpg,0,Một người đàn ông mặc quần áo tennis màu xanh và áo polo trắng đang đánh bóng tennis,31125
8112722587.jpg,1,Một người chơi tennis đang chuẩn bị đánh quả bóng đang bay đến ,31125
8112722587.jpg,2,Một người đàn ông trung niên sắp đánh một quả bóng tennis bằng vợt của mình,31125
8112722587.jpg,3,Một người chơi tennis cố gắng đánh một cú đánh vào quả bóng chuyền,31125
8112722587.jpg,4,Một người đàn ông mặc áo trắng đang chơi tennis,31125
8112734986.jpg,0,Một vận động viên quần vợt mặc quần đùi màu xanh và áo trắng thực hiện một cú vung vợt trái tay về phía quả bóng quần vợt,31126
8112734986.jpg,1,Trận đấu quần vợt nam đang diễn ra trên sân,31126
8112734986.jpg,2,Một vận động viên quần vợt chuyên nghiệp đang đỡ một quả bóng trong trận đấu tennis,31126
8112734986.jpg,3,Một vận động viên quần vợt đang đánh bóng cho đối thủ của mình,31126
8112734986.jpg,4,Hai người đàn ông chơi quần vợt một người đang đánh bóng,31126
8127485677.jpg,0,Hai cô gái trên sân đang chạy và chuẩn bị tiếp cận quả bóng đá để đá nó trong khi một cô gái khác đang chạy theo hướng của họ từ phía sau khi người hâm mộ đang theo dõi từ khán đài,31141
8127485677.jpg,1,Hai người phụ nữ đang cạnh tranh nhau quả bóng trong một trận đấu bóng đá,31141
8127485677.jpg,2,Hai cầu thủ bóng đá tranh giành quyền sở hữu bóng đá,31141
8127485677.jpg,3,Hai cô gái đang chơi bóng đá và tranh giành quả bóng,31141
8127485677.jpg,4,Hai cầu thủ bóng đá đang tranh bóng,31141
8188882833.jpg,0,Hai vận động viên bóng chuyền nam mặc đồng phục màu xanh nhạt đánh bóng qua lưới,31224
8188882833.jpg,1,Đội đen vừa đánh một quả bóng về phía đội xanh,31224
8188882833.jpg,2,Hai cầu thủ bóng chuyền nam đang đỡ bóng,31224
8188882833.jpg,3,Những người đàn ông đang chơi bóng chuyền,31224
8188882833.jpg,4,Đàn ông đang chơi bóng chuyền trong nhà,31224
8198726446.jpg,0,Bốn người đàn ông hai người mặc đồng phục màu trắng hai người còn lại mặc đồng phục màu đen và một người trong số đó vừa nhảy lên không trung để thực hiện cú ném bóng rổ,31234
8198726446.jpg,1,Cầu thủ mặc đồng phục màu đen trong một trận đấu bóng rổ sắp ghi bàn trong khi xung quanh là các cầu thủ mặc đồ trắng,31234
8198726446.jpg,2,Một cầu thủ bóng rổ đang ném bóng vào rổ,31234
8198726446.jpg,3,Một người đàn ông đang chơi bóng rổ,31234
8198726446.jpg,4,Một cầu thủ bóng rổ đang chơi bóng rổ,31234
8211471228.jpg,0,Một cầu thủ bóng rổ tiếp cận lưới trên không trong nỗ lực thực hiện cú úp rổ qua tầm với của đối thủ,31243
8211471228.jpg,1,Trong một trò chơi bóng rổ một cầu thủ sắp ghi bàn trong khi đối thủ đang cố gắng chặn nó,31243
8211471228.jpg,2,Một cầu thủ bóng rổ nhảy lên để ném rổ khi một cầu thủ của đội đối phương nhảy lên để cố gắng cản phá,31243
8211471228.jpg,3,Hai cầu thủ bóng rổ nhảy lên không trung khi một người chuẩn bị thực hiện cú úp rổ,31243
8211471228.jpg,4,Một số người đàn ông đang chơi bóng rổ tại một phòng tập thể dục trường trung học,31243
8218123217.jpg,0,Trong một trận bóng đá với một cầu thủ đang ném bóng,31252
8218123217.jpg,1,Một cầu thủ tung một đường chuyền trong một trận đấu bóng đá,31252
8218123217.jpg,2,Một cầu thủ bóng đá đang ném bóng trong một trận đấu,31252
8218123217.jpg,3,Một cầu thủ bóng đá ném bóng khi các cầu thủ bóng đá khác nhìn vào,31252
8218123217.jpg,4,Một cầu thủ đang ném bóng trong một trận đấu,31252
8234387593.jpg,0,Cầu thủ mặc đồng phục trắng và đỏ đang nhảy lên ném bóng trong khi đối thủ mặc đồng phục đỏ và đen chặn cú ném của anh ta,31265
8234387593.jpg,1,Ba cầu thủ bóng rổ tranh bóng và một người mặc áo đỏ đang cố lấy bóng từ anh chàng mặc áo trắng,31265
8234387593.jpg,2,Bốn chàng trai da trắng đang chơi bóng rổ và cầu thủ áo trắng sắp ghi bàn vào rổ,31265
8234387593.jpg,3,Hai thanh niên đang chơi bóng rổ một người đang ngăn chặn người còn lại ghi bàn,31265
8234387593.jpg,4,Hai thanh niên một người mặc áo trắng và một ngườii mặc áo đỏ đang chơi bóng rổ,31265
8245313425.jpg,0,Hai cầu thủ bóng rổ một người mặc đồ trắng người kia mặc đồ đỏ đang thi đấu trong một trận đấu bóng rổ,31283
8245313425.jpg,1,Một cầu thủ bóng rổ chuẩn bị ném trong khi đối thủ của anh ta đang đuổi theo ngăn cản,31283
8245313425.jpg,2,Hai người chơi bóng rổ đang rượt đuổi nhau,31283
8245313425.jpg,3,Hai đội bóng rổ đại học đang thi đấu với nhau,31283
8245313425.jpg,4,Cầu thủ đang rê bóng thoát khỏi sự truy đuổi của đối thủ trong một trận đấu bóng rổ,31283
8245366095.jpg,0,Một cầu thủ bóng rổ nữ mặc áo trắng đang di chuyển với quả bóng xung quanh có một cầu thủ đối phương mặc áo đen,31284
8245366095.jpg,1,Một trận đấu bóng rổ của các cô gái với cô gái mặc đồ trắng đang rê bóng với các cô gái mặc đồ đen đang phòng thủ,31284
8245366095.jpg,2,Một trận đấu bóng rổ nữ đang diễn ra đội mặc áo trắng có bóng trong khi đội màu đen đang ngăn chặn,31284
8245366095.jpg,3,Một cô gái đang chạy với một quả bóng rổ trong khi một người khác cố cướp quả bóng của cô ấy,31284
8245366095.jpg,4,Một cô gái có quả bóng trong trò chơi bóng rổ,31284
944374205.jpg,0,Những đứa trẻ đang chơi đá bóng ở sân trước tòa nhà,31620
944374205.jpg,1,Một nhóm nam sinh chơi bóng đá trên bãi cỏ trong khi một nhóm khác nhìn xuống từ một tảng đá,31620
944374205.jpg,2,Một nhóm các cậu bé đang chơi bóng đá trước một ngọn đồi nhỏ,31620
944374205.jpg,3,Tám cậu bé chơi bóng đá trên bãi cỏ,31620
944374205.jpg,4,Trẻ em chơi bóng đá trên sân,31620
