image,caption_number,caption,id
542714962.jpg,0,Một trò chơi bóng chuyền đang diễn ra và một người đàn ông đang nhảy cao để làm tường chắn bóng,26974
542714962.jpg,1,Một số thanh niên đang chơi bóng chuyền trên cát,26974
542714962.jpg,2,Một nhóm thanh niên đang chơi bóng chuyền trên bãi biển bên cạnh thành phố,26974
542714962.jpg,3,Những người đàn ông đang chơi bóng chuyền giữa trời nắng trên cát,26974
542714962.jpg,4,Một vài người đàn ông đang chơi bóng chuyền với một số người xem xung quanh,26974
5610848512.jpg,0,Một người đàn ông tóc đen nhảy lên không trung để đánh bóng trong một trận đấu bóng chuyền,27310
5610848512.jpg,1,Một người đàn ông đang đánh một quả bóng chuyền ở giữa không trung,27310
5610848512.jpg,2,Một anh chàng mặc quần short màu xám đang đánh một quả bóng chuyền trên bãi biển,27310
5610848512.jpg,3,Một thanh niên đang nhảy cao đánh bóng trong khi đối thủ của anh ấy đang trong trạng thái phòng thủ,27310
5610848512.jpg,4,Một chàng trai nhảy lên không trung để đập một quả bóng trong trận đấu bóng chuyền trên bãi biển,27310
5730196560.jpg,0,Một cậu bé đang bắt bóng bên cạnh gôn trong khi cầu thủ đối phương đang trượt trên đất cố gắng chạm vào gôn,27533
5730196560.jpg,1,Hai người cậu bé trong trang phục bóng chày đang chơi bóng chày một người là cầu thủ phòng ngự còn người kia là runner,27533
5730196560.jpg,2,Một cậu bé cố gắng trượt đến gôn để an toàn trong một trò chơi bóng chày,27533
5730196560.jpg,3,Một cậu bé là runner đang cố trượt vào gôn trước khi cầu thủ phòng ngự bắt được bóng,27533
5730196560.jpg,4,Một đứa trẻ đang cố chạm vào gôn trong khi cầu thủ đối phương đứng bên cạnh,27533
5767811093.jpg,0,Một hitter đang vung gậy bóng chày và người bắt bóng đang ở ngay bên cạnh,27606
5767811093.jpg,1,Một cầu thủ bóng chày đang đánh bóng với người bắt bóng và trọng tài phía sau anh ta,27606
5767811093.jpg,2,Một người đánh bóng người bắt bóng và trọng tài ở đứng ở đĩa nhà trong một trận bóng chày,27606
5767811093.jpg,3,Một người đàn ông đang chơi bóng chày và đang vung gậy đánh bóng,27606
5767811093.jpg,4,Một cầu thủ bóng chày đang đánh một quả bóng bay đến,27606
5847749710.jpg,0,Một trận đấu bóng chày đang diễn ra với lợi thế thuộc về đội đỏ vì cầu thủ đã nhận được bóng và đứng ngay bên cạnh gôn,27743
5847749710.jpg,1,Một người đàn ông bắt được quả bóng trong găng tay trong khi runner đang đứng ngoài vùng an toàn,27743
5847749710.jpg,2,Một cầu thủ phòng ngự sắp chiếm được gôn bởi vì đã nhận được bóng từ đồng đội,27743
5847749710.jpg,3,Một cầu thủ vừa ném bóng cho đồng đội của mình trong khi một runner đang chạy đến,27743
5847749710.jpg,4,Trận đấu bóng chày đang diễn ra trên sân cỏ và cầu thủ đội đỏ đã nhận được bóng tại gôn,27743
5914778546.jpg,0,Một cầu thủ bóng chày đã chạm vào gôn trong khi người bắt bóng vừa mới nhận bóng chày bên ngoài khu vực,27847
5914778546.jpg,1,Một cầu thủ bóng chày đang trượt về phía gôn để ghi điểm cho đội của mình,27847
5914778546.jpg,2,Một cầu thủ bóng chày đang bắt bóng trong khi runner đội đối thủ đã chạm vào gôn sau lưng anh ta,27847
5914778546.jpg,3,Các thành viên đội đỏ đang xem trận đấu bóng chày phía sau hàng rào,27847
5914778546.jpg,4,Một cầu thủ bóng chày trong bộ trang phục bóng chày màu đỏ trượt đến chạm vào gôn,27847
5914789066.jpg,0,Cầu thủ bóng chày đang cố gắng đánh bóng trong khi người bắt bóng đang sẵn sàng bắt quả bóng,27848
5914789066.jpg,1,Một cầu thủ bóng chày áo xanh đang đánh bóng trong khi người bắt bóng và trọng tài đang đứng bên cạnh,27848
5914789066.jpg,2,Một cầu thủ bóng chày đội xanh đang vung gậy về phía quả bóng,27848
5914789066.jpg,3,Trận đấu bóng chày đang diễn ra và một cầu thủ đang chuẩn bị đánh bóng,27848
5914789066.jpg,4,Một quả bóng đã được ném và cầu thủ đang chuẩn bị đánh quả bóng ấy,27848
5925539370.jpg,0,Ba cầu bé đang chơi ném bóng chày trên sân vận động,27879
5925539370.jpg,1,Ba đứa trẻ chơi bóng chày trên sân và đứng tại vị trí ném bóng,27879
5925539370.jpg,2,Những cậu bé mang găng tay bóng chày đang đứng trên sân,27879
5925539370.jpg,3,Một cậu bé cao to đang ném bóng trong khi hai cậu bé khác đang đứng cạnh bên chờ đợi đến lượt,27879
5925539370.jpg,4,Một cậu bé đang ném một quả bóng chày trong khi hai cậu bé còn lại đang nhìn theo,27879
5989324335.jpg,0,Người chơi trong bộ trang phục bóng chày màu trắng đang trượt vào gôn trong khi người chơi đối thủ cố gắng chạm vào anh ta,27972
5989324335.jpg,1,Một cầu thủ bóng chày màu trắng đang trượt vào gôn trong khi đối thủ đang cố gắng loại anh ta,27972
5989324335.jpg,2,Trong một trận bóng chày một người chơi đang trượt trên mặt đất để đến gôn kịp thời,27972
5989324335.jpg,3,Một cầu thủ bóng chày đang cố gắng chạm vào gôn trước khi đối thủ chạm vào anh ta,27972
5989324335.jpg,4,Một cầu thủ bóng chày trượt đến gôn trong khi cầu thủ phòng ngự đối phương đang đứng trước mặt anh ta,27972
6071314957.jpg,0,Một người chơi tennis đang nhảy lên để đánh bóng về phía đối thủ,28070
6071314957.jpg,1,Hai người đang chơi tennis trên sân và người phụ nữ áo vàng đang đánh bóng,28070
6071314957.jpg,2,Hai cô gái chơi tennis và cô gái áo vàng đang nhảy lên không trung để đánh quả bóng cho đối phương,28070
6071314957.jpg,3,Hai người phụ nữ đang đánh quần vợt và một trong hai đang nhảy lên đánh bóng,28070
6071314957.jpg,4,Cô gái áo vàng đang đánh bóng trên không trung trong khi người đối diện đang trong tư thế sẵn sàng đỡ bóng,28070
610841649.jpg,0,Trận bóng đá đang diễn ra với hai đội bóng trong trang phục đỏ và trắng,28132
610841649.jpg,1,Đội bóng áo đỏ đang đá phạt trước hàng rào phòng thủ áo trắng,28132
610841649.jpg,2,Cầu thủ đội đỏ đang thực hiện cú đá trong khi thủ môn đang sẵn sàng để đỡ được quả bóng đang bay vào khung thành,28132
610841649.jpg,3,Tất cả các cầu thủ đều đang dõi theo vị trí của quả bóng sau khi một cầu thủ sút bóng,28132
610841649.jpg,4,Một cầu thủ đội đỏ đá quả bóng về phía gôn và thủ môn áo đen đội đối thủ đang bảo vệ khung thành của mình,28132
6123457215.jpg,0,Một cầu bé trong trang phục màu vàng đang bị vây quanh bởi các cầu thủ áo đỏ trong trận đấu bóng bầu dục,28146
6123457215.jpg,1,Hai chàng trai đội màu đỏ đang chặn một cầu thủ đội vàng đang cầm bóng,28146
6123457215.jpg,2,Cầu thủ bóng bầu dục áo vàng đang cố gắng tránh khỏi sự truy bắt của hai cậu bé trong trang phục đỏ,28146
6123457215.jpg,3,Một trận bóng bầu dục đang diễn ra trên sân khi đội vàng đang có bóng và đội đỏ đang phòng thủ,28146
6123457215.jpg,4,Cầu thủ đội vàng đang thoát ra vòng vây của những cầu thủ đối phương,28146
6142033763.jpg,0,Các chàng trai trẻ đang chơi bóng rổ trong nhà thể thao và một trong số đó đang nhảy lên,28173
6142033763.jpg,1,Bốn thanh niên đang chơi bóng rổ và một chàng trai đang nhảy cao để giành lấy bóng,28173
6142033763.jpg,2,Chàng trai áo xanh dương đang nhảy lên không trung trong khi các cầu thủ còn lại đang nhìn theo anh ấy,28173
6142033763.jpg,3,Một người đàn ông mặc đồng phục bóng rổ màu xanh nhảy lên không trung để đánh bóng trong khi những chàng trai còn lại đang đứng xung quanh,28173
6142033763.jpg,4,Có bốn chàng trai trong một phòng tập thể dục đang chơi bóng rổ,28173
6180807938.jpg,0,Trò chơi bóng đá đang diễn ra khi đội bóng áo sọc đang giữ bóng và cầu thủ đội xanh lam đang đuổi theo để giành lấy,28256
6180807938.jpg,1,Một cầu thủ bóng đá áo sọc đang đi bóng trong khi cầu thủ đối phương đang truy đuổi anh ta,28256
6180807938.jpg,2,Nhiều khán giả đang xem một trận bóng đá chuyên nghiệp của đội bóng màu xanh sọc đỏ và đội bóng trang phục màu xanh lam,28256
6180807938.jpg,3,Ba cầu thủ đang ở trên sân và một trong số đó đang dẫn bóng tránh khỏi sự phòng ngự của đối thủ,28256
6180807938.jpg,4,Khán giả bên ngoài sân cỏ đang chăm chú theo dõi một trận đấu bóng đá giữa đội tím xanh và đội xanh nhạt,28256
6187182607.jpg,0,Một người đánh bóng trong trang phục quần trắng áo đen đang cố gắng đánh bóng chày với một người bắt bóng phía sau anh ta trong khi một trọng tài đang quan sát họ,28266
6187182607.jpg,1,Trong một trò chơi bóng chày người đánh bóng đang đong đưa vào quả bóng trong khi người bắt giữ kiên nhẫn chờ đợi bóng đánh găng tay,28266
6187182607.jpg,2,Ba người đàn ông đang đứng ở gôn nhà và người đánh bóng đang vung gậy bóng chày của anh về phía quả bóng đang bay đến,28266
6187182607.jpg,3,Một cầu thủ bóng chày với người bắt bóng và trọng tài ở ngay sau anh ta đang chuẩn bị đánh bóng,28266
6187182607.jpg,4,Một người đánh bóng sắp đánh một quả bóng với một người bắt bóng và trọng tài phía sau anh ta,28266
6188752802.jpg,0,Một người chơi phụ nữ trong trang phục trắng và đen đưa quả bóng chuyền qua lưới trong khi đội đối phương trong trang phục xanh navy cố gắng chặn nó trước sự quan sát của một huấn luyện viên và một vài khán giả đang theo dõi trận đấu,28276
6188752802.jpg,1,Một trò chơi bóng chuyền nữ với một đội đang mặc trang phục trắng chủ đạo và đội còn lại mặc áo xanh lá,28276
6188752802.jpg,2,Một cầu thủ bóng chuyền nữ đang nhảy về phí quả bóng chuyền,28276
6188752802.jpg,3,Người chơi bóng chuyền nữ đang tham gia một trận đấu bóng chuyền,28276
6188752802.jpg,4,Những cô gái này đang chơi bóng chuyền,28276
6198363555.jpg,0,Một nhóm một người đàn ông đang chơi bóng rổ trên một sân bóng ngoài trời,28298
6198363555.jpg,1,Một nhóm thanh niên đang chơi bóng rổ ngoài trời,28298
6198363555.jpg,2,Một nhóm người trẻ đang chơi một trò chơi bóng rổ,28298
6198363555.jpg,3,Bốn người đàn ông đang chơi một trận bóng rổ với nhau,28298
6198363555.jpg,4,Một nhóm người đàn ông đang chơi bóng rổ,28298
6201295346.jpg,0,Hai cầu thủ bóng đá chuyên nghiệp một người mặc áo đỏ quần short đen người còn lại mặc áo xanh quần short trắng, đang cạnh tranh để kiểm soát bóng,28309
6201295346.jpg,1,Một người đàn ông da trắng mặc đồng phục màu xanh đang đẩy một người đàn ông da đen mặc đồng phục màu đỏ trong một trận bóng trên sân cỏ,28309
6201295346.jpg,2,Hai cầu thủ bóng đá một người mặc áo màu đỏ và một trong trang phục màu xanh đang chơi bóng đá với nhau,28309
6201295346.jpg,3,Cầu thủ bóng đá đội màu đỏ và đội xanh đang cố gắng giành lấy bóng để ghi bàn thắng,28309
6201295346.jpg,4,Hai cầu thủ bóng đá đang cạnh tranh một quả bóng trong một trận đấu,28309
6204719881.jpg,0,Ở phía trước một cầu thủ bóng đá trang phục màu cam và đen di chuyển để chặn hai cầu thủ mặc đồng phục màu trắng bởi vì họ đang cố gắng đưa quả bóng đi,28314
6204719881.jpg,1,Bốn người đàn ông đang chơi bóng đá với nhau, hai người mặc áo trắng một người trong trang phục áo đỏ và một thủ môn trong ở phía sau,28314
6204719881.jpg,2,Ba người hai người mặc áo màu trắng một người màu đỏ và đen đang chơi bóng đá,28314
6204719881.jpg,3,Ba người đàn ông cạnh tranh nhau trong một trận bóng đá trên sân bóng đá,28314
6204719881.jpg,4,Một nhóm người đàn ông đang chơi bóng đá,28314
6206340700.jpg,0,Một cầu thủ bóng bầu dục đội nâu đang cố gắng chạy thoát khỏi các cầu thủ đội trắng với quả bóng trên tay,28320
6206340700.jpg,1,Cầu thủ bóng bầu dục đội màu nâu đang chạy với quả bóng tránh sự truy đuổi của những cầu thủ đội màu trắng,28320
6206340700.jpg,2,Người chơi bóng bóng bầu dục đang cố gắng đưa bóng lên để ghi bàn trong tuyệt vọng,28320
6206340700.jpg,3,Một cầu thủ bóng bầu dục đại học đang chạy với quả bóng thoát khỏi cầu thủ phòng ngự đội bạn,28320
6206340700.jpg,4,Những người đàn ông đang ở trên sân chơi bóng đá,28320
6212107040.jpg,0,Cầu thủ bóng chày đứng sau gôn nhà nhìn đồng đội của anh ta trở về nhà ngay phía sau người bắt bóng,28337
6212107040.jpg,1,Một người đàn ông mặc áo xanh đang băng qua đĩa nhà trong một trận bóng chày,28337
6212107040.jpg,2,Một cầu thủ bóng chày trong trang phục màu xanh ghi điểm bằng cách chạy qua đĩa nhà,28337
6212107040.jpg,3,Thành viên của đội bóng chày đang băng qua đĩa,28337
6212107040.jpg,4,Cầu thủ bóng chày đang băng qua gôn nhà,28337
6224066807.jpg,0,Một cầu thủ bóng đá đang trên sân bóng chuẩn bị đá quả bóng,28365
6224066807.jpg,1,Một chàng trai mặc đồng phục màu trắng đang chơi bóng đá,28365
6224066807.jpg,2,Một người đàn ông mặc một chiếc áo trắng sắp đá một quả bóng đá,28365
6224066807.jpg,3,Một người đàn ông có đồng phục bóng đá đang đá một quả bóng đá,28365
6224066807.jpg,4,Một người đàn ông đang đá một quả bóng đá,28365
6253003614.jpg,0,Một cầu thủ bóng đá mặc đồng phục trắng chạy lướt qua những cầu thủ khác đang ở trên sân trong khi một người hâm mộ đang ăn mừng vì bóng đi vào lưới,28419
6253003614.jpg,1,Ba người đàn ông đang chơi bóng đá với một số khán giả,28419
6253003614.jpg,2,Cầu thủ bóng đá đang trong trận đấu với một quả bóng đi vào lưới,28419
6253003614.jpg,3,Những đứa trẻ này đang vui vẻ chơi đá bóng trên sân,28419
6253003614.jpg,4,Một bàn thắng đã được ghi trong một trận bóng đá,28419
6271611352.jpg,0,Năm cậu bé hai người mặc áo xanh lá ba người mặc trang phục màu xanh dương đang chơi bóng đá trên sân với một hàng rào ở phía sau,28441
6271611352.jpg,1,Một số đứa trẻ đang chơi với một quả bóng bên ngoài trời,28441
6271611352.jpg,2,Năm đứa trẻ trẻ đang tham gia vào một trò chơi bóng đá,28441
6271611352.jpg,3,Năm cậu bé đang chơi bóng đá,28441
6271611352.jpg,4,Năm bé trai đang chơi bóng đá,28441
6283123175.jpg,0,Một cầu thủ bóng chuyền nữ đang nhảy đến một quả bóng chuyền ở phía đối diện của đội màu xanh,28477
6283123175.jpg,1,Một cầu thủ bóng chuyền nhảy lên để chạm được quả bóng trong một trận bóng chuyền nữ,28477
6283123175.jpg,2,Một cô gái đang nhảy lên đánh bóng trong một cuộc thi bóng chuyền trung học,28477
6283123175.jpg,3,Một đội bóng chuyền nữ đang tham gia thi đấu bóng chuyền,28477
6283123175.jpg,4,Một đội bóng chuyền nữ đang tập luyện,28477
6309593797.jpg,0,Một người ném bóng đang ném một quả bóng chày đến người bắt bóng là người đang đứng trước một trọng tài và đằng sau người đánh bóng,28528
6309593797.jpg,1,Một người ném bóng ném một quả bóng bay nhanh đến vị trí của người đánh bóng người bắt bóng và trọng tài,28528
6309593797.jpg,2,Một người ném bóng vừa hoàn thành thực hiện việc ném quả bóng về phía người đánh bóng trên sân bóng chày,28528
6309593797.jpg,3,Một nhóm người đàn ông chơi bóng chày với một người đàn ông ném bóng,28528
6309593797.jpg,4,Anh ta vừa thực hiện cú ném bóng và người đánh bóng đã sẵn sàng,28528
6312211170.jpg,0,Cầu thủ bóng đá mặc đồng phục màu xanh và trắng đang nhảy lên không trung,28536
6312211170.jpg,1,Hai thanh niên chơi bóng đá vào một ngày nắng đang nhảy lên vì quả bóng,28536
6312211170.jpg,2,Cầu thủ bóng đá trong trang phục xanh và trắng đấu tranh cho quả bóng trong không trung,28536
6312211170.jpg,3,Các cầu thủ bóng đá trên sân đang đá bóng với nhau,28536
6312211170.jpg,4,Ba chàng trai đang chơi bóng đá,28536
6341181416.jpg,0,Một cầu thủ bóng bầu dục trong một chiếc áo màu xanh với chiếc quần vàng mang theo quả bóng bầu dục trong khi đồng đội của anh ta và đội bóng đối thủ mặc trang phục màu cam và trắng đang chạy ngay phía sau anh ta,28617
6341181416.jpg,1,Một cầu thủ của đội bóng bầu dục đồng phục màu xanh và vàng đang chạy đến vùng an toàn phía khu vực cuối,28617
6341181416.jpg,2,Một cầu thủ bóng bầu dục đang có quả bóng trên tay đang mặc trang phục xanh với đội đối thủ trong trang phục trắng,28617
6341181416.jpg,3,Sáu chàng trai đang chơi bóng bầu dục với nhau và một người có bóng trên tay đang chạy nước rút,28617
6341181416.jpg,4,Một cầu thủ bóng bầu dục trường trung học đang chạy nước rút đến vùng cuối,28617
6342265060.jpg,0,Hai đội bóng đá với một đội trang phục màu xanh lá và đội kia mặc trang phục màu đỏ trong một trận đấu,28623
6342265060.jpg,1,Hai đội một đội mặc màu xanh lá cây một đội mặc trang phục màu đỏ đang tham gia một trận đấu bóng đá,28623
6342265060.jpg,2,Trong một trận bóng đá hai người chơi đang nhảy lên để đánh đầu vào quả bóng,28623
6342265060.jpg,3,Hai cầu thủ bóng đá từ hai đội khác nhau đang nhảy lên không trung,28623
6342265060.jpg,4,Một số người đàn ông mặc đồng phục xanh và đồng phục đỏ đang chơi bóng đá,28623
6362439531.jpg,0,Một người đàn ông vừa ném một quả bóng đến người đàn ông khác người đã vung gậy đánh bóng trong khi người bắt bóng đang quan sát ở phía sau,28646
6362439531.jpg,1,Ba cầu thủ bóng chày đang trong trạng thái chuẩn bị trong một trận đấu trên sân cỏ,28646
6362439531.jpg,2,Ba người đang chơi một trận đấu bóng chày trong trang phục màu trắng,28646
6362439531.jpg,3,Ba chàng trai đang chơi bóng chày trong khu vực có nhiều cây cọ,28646
6362439531.jpg,4,Ba người chơi bóng chày trong trang phục trắng đang chuẩn bị bắt đầu trận đấu,28646
6419839253.jpg,0,Một người đàn ông đá một quả bóng trong tư thế đưa chân thẳng lên không trung ở bên cạnh người đàn ông có một hình xăm lớn trên lưng,28708
6419839253.jpg,1,Ba thanh niên đang chơi bóng đá trên bãi biển trong trang phục quần short và trang phục bãi biển trong khi một số người đang quan sát họ,28708
6419839253.jpg,2,Ba thanh niên đang đá một quả bóng đá trên bãi biển,28708
6419839253.jpg,3,Một người đàn ông với một chiếc áo và hai người đàn ông không mặc áo chơi bóng đá trên cát trước một số khán giả,28708
6419839253.jpg,4,Các vận động viên đang thi đấu trong một cuộc thi bóng đá,28708
6462908751.jpg,0,Bốn chàng trai đang chơi bóng rổ một đội có trang phục vàng và màu xanh lam đội còn lại mặc trang phục đỏ và trắng,28751
6462908751.jpg,1,Một cầu thủ bóng rổ mặc đồ trắng đang quan sát đối thủ của mình người mặc đồ đen đang rê bóng rổ trong trận đấu bóng rổ,28751
6462908751.jpg,2,Học sinh học trung học chơi bóng rổ trong một phòng tập thể dục trong khi rất nhiều khán giả xem,28751
6462908751.jpg,3,Những cầu thủ bóng rổ đang cố gắng ngăn chặn đội đối thủ,28751
6462908751.jpg,4,Một cậu bé đang rê bóng trong một trận bóng rổ,28751
6474862163.jpg,0,Cầu thủ bóng rổ ném bóng vào rổ với quả bóng vừa rời khỏi đầu ngón tay anh ấy,28764
6474862163.jpg,1,Một cầu thủ bóng rổ đang ném bóng vào rổ trong khi đồng đội của anh ta giữ chân thành viên đội đối thủ,28764
6474862163.jpg,2,Một cầu thủ bóng rổ đang thực hiện một cú nhảy ghi bàn trong khi đối thủ đang đứng phía sau anh ta,28764
6474862163.jpg,3,Một người đàn ông trong một bộ đồng phục bóng rổ màu trắng đang đưa bóng vào rổ,28764
6474862163.jpg,4,Một cầu thủ bóng rổ đang ném quả bóng ghi bàn,28764
6474894623.jpg,0,Hai đội bóng rổ trong trận đấu đang xem một quả bóng bay về phía mục tiêu,28766
6474894623.jpg,1,Trận đấu bóng rổ đang diễn ra với hai đội màu trắng và đỏ trên sân,28766
6474894623.jpg,2,Hai đội đang chơi bóng rổ trên sân trong một sân vận động trống rỗng,28766
6474894623.jpg,3,Một cầu thủ bóng rổ vừa thực hiện một cú ném và đang ngã xuống,28766
6474894623.jpg,4,Một trận đấu bóng rổ đang diễn ra,28766
6475050767.jpg,0,Cầu thủ bóng rổ cố gắng vượt qua một hậu vệ của đội màu đỏ,28768
6475050767.jpg,1,Các cầu thủ bóng rổ đang chơi bóng rổ trước một số ít khán giả,28768
6475050767.jpg,2,Một cầu thủ bóng rổ đang rê bóng,28768
6475050767.jpg,3,Những chàng trai đang chơi bóng rổ trong một sân vận động,28768
6475050767.jpg,4,Những chàng trai đang chơi bóng rổ trường đại học,28768
6569938885.jpg,0,Một đội bóng chuyền trong trang phục màu đỏ ở một bên và đội bóng chuyền có trang phục màu vàng và màu xanh là đội đối thủ đang chơi bóng chuyền trên sân,28865
6569938885.jpg,1,Ba thành viên thuộc đội bóng chuyền màu đỏ đang nhảy lên lưới để chặn cú đánh từ đội đối thủ,28865
6569938885.jpg,2,Một cầu thủ trong trang phục màu vàng xanh đánh quả bóng chuyền qua lưới trong khi ba người đội thủ đang ngăn chặn,28865
6569938885.jpg,3,Một đội bóng chuyền đang cố gắng ngăn chặn bóng đi qua lưới,28865
6569938885.jpg,4,Đây là một nhóm cầu thủ bóng chuyền đang tham gia vào một trận đấu bóng chuyền,28865
6638041153.jpg,0,Hai đội bóng chuyền nữ một màu xanh và trắng và một màu xanh lá cây và trắng đang chơi bóng chuyền,28930
6638041153.jpg,1,Các cầu thủ bóng chuyền nữ đang cố gắng giành quyền kiểm soát quả bóng trong không trung,28930
6638041153.jpg,2,Hai người phụ nữ cố gắng chặn một cú đánh bóng trong một trận đấu bóng chuyền,28930
6638041153.jpg,3,Có hai đội đang thi đấu cạnh tranh nhau trong một trận đấu bóng chuyền của phụ nữ,28930
6638041153.jpg,4,Một trận đấu bóng chuyền nữ đang diễn ra trong một phòng tập thể dục,28930
6696752075.jpg,0,Một cậu bé mặc đồng phục đưa găng tay của mình ngay trước khi anh ta bắt bóng chày,28987
6696752075.jpg,1,Cậu bé trong bộ đồng phục bóng chày sắp bắt được một quả bóng chày trong găng tay của mình,28987
6696752075.jpg,2,Một cậu bé trong một bộ trang phục bóng chày đang bắt bóng chày,28987
6696752075.jpg,3,Một cậu bé trong bộ đồng phục bóng chày đang bắt bóng,28987
6696752075.jpg,4,Một cậu bé đang chơi bóng chày,28987
6706751023.jpg,0,Một cầu thủ bóng rổ trong một bộ đồng phục màu trắng đang rê bóng rổ qua một cầu thủ trong bộ đồng phục màu đen,28996
6706751023.jpg,1,Một cô gái mặc đồng phục bóng rổ trắng đang rê bóng rổ qua một cô gái mặc đồng phục màu đen,28996
6706751023.jpg,2,Một cầu thủ bóng rổ nữ đang rê bóng rổ qua một cầu thủ khác,28996
